id,community_profile,name,angellist_url,logo_url,thumb_url,quality,product_desc,high_concept,follower_count,company_url,created_at,updated_at,crunchbase_url,twitter_url,blog_url,facebook_url,linkedin_url,video_url,markets,locations,company_size,company_type,status,screenshots
4811839,0,miza,https://angel.co/mizawallet,https://d1qb2nb5cznatu.cloudfront.net/startups/i/4811839-0717e5792feca36e1415e1ff884d58ee-medium_jpg.jpg?buster=1508579724,https://d1qb2nb5cznatu.cloudfront.net/startups/i/4811839-0717e5792feca36e1415e1ff884d58ee-thumb_jpg.jpg?buster=1508579724,0,"MIZA mobile wallet","Mobile wallet company",1,http://www.miza.ly,2017-10-21T09:55:25.000Z,2017-10-21T10:04:14.000Z,,,,,,,"Mobile Commerce, Fin Tech",Tripoli,,,,
3624719,0,FutureBox,https://angel.co/futurebox,https://d1qb2nb5cznatu.cloudfront.net/startups/i/3624719-b30dfbcade9eeba46fc44a62b7a42eb1-medium_jpg.jpg?buster=1487005005,https://d1qb2nb5cznatu.cloudfront.net/startups/i/3624719-b30dfbcade9eeba46fc44a62b7a42eb1-thumb_jpg.jpg?buster=1487005005,6,"FutureApps with it's app FutureBox is an award winning app in the commitments challenge by former President Bill Clinton and Chelsea Clinton in 2016.

we focus on developing and the improvement of people’s everyday lives through enhanced access to information. We are in the process of developing our first innovative app FutureBox, a mobile app that searches for news before it happens!","Your personal curated Newsline.",2,http://www.FutureAppsCo.com,2017-02-13T16:56:45.000Z,2017-02-13T17:04:21.000Z,http://www.crunchbase.com/organization/%2Forganization%2Ffuturebox,,,,,https://www.youtube.com/watch?v=_n61jlOlnYA,"News, Social News","Chicago, Tripoli",1-10,,,https://d2gn4xht817m0g.cloudfront.net/p/product_screenshots/images/original/000/789/163/789163-beea414afa271ab7c8fc7af6279625a80eb33c94.png?1487005245
2767436,0,"Rio company for foodstuff import L.t.d",https://angel.co/rio-company-for-foodstuff-import-l-t-d,https://d1qb2nb5cznatu.cloudfront.net/startups/i/2767436-f842252ff4067bec4b7203faa7910b8f-medium_jpg.jpg?buster=1476738901,https://d1qb2nb5cznatu.cloudfront.net/startups/i/2767436-f842252ff4067bec4b7203faa7910b8f-thumb_jpg.jpg?buster=1476738901,2,"all consumer products","Consumer product import",1,http://www.rio.ly,2016-10-17T20:54:34.000Z,2016-10-17T21:15:34.000Z,,,,,,,"South East Asia, Latin America, Europe, North America   English For Now",Tripoli,1-10,"Technology Provider, Food & Tech, Organic Beverages, Foodtech, Food Processing , Food Research.",,
2004670,0,"Libyan Scientific Community",https://angel.co/libyan-scientific-community,https://d1qb2nb5cznatu.cloudfront.net/startups/i/2004670-3c2fd2b2646f3981a327b9833ab1dd7d-medium_jpg.jpg?buster=1472323861,https://d1qb2nb5cznatu.cloudfront.net/startups/i/2004670-3c2fd2b2646f3981a327b9833ab1dd7d-thumb_jpg.jpg?buster=1472323861,4,"Fostering Science and Research in Libya","Fostering Science and Research",3,http://www.LYSIC.org,2016-08-27T18:40:12.000Z,2016-08-27T18:51:05.000Z,,,,,,,"Nonprofits, Non Profit, Non Profits, Science",Libya,11-50,,,
1856813,0,"Expertise Consultancy",https://angel.co/expertise-consultancy,https://d1qb2nb5cznatu.cloudfront.net/startups/i/1856813-ee6bd83303e851ef1cd80cd602d4a500-medium_jpg.jpg?buster=1471515254,https://d1qb2nb5cznatu.cloudfront.net/startups/i/1856813-ee6bd83303e851ef1cd80cd602d4a500-thumb_jpg.jpg?buster=1471515254,4,"Expertise Consultancy offer real life training solutions to Governments, International Business, private individuals as well as Security Consultancy and Operations in UK and Middle East and North Africa. 
With offices in Bristol, UK and Tripoli, Libya we are well placed to support International Business to re enter the highly lucrative Libyan Market.","Exciting Security Training and Operations",1,http://www.expertiseconsultancy.co.uk,2016-08-18T10:14:14.000Z,2016-08-18T10:32:55.000Z,,,,,,,"Security, Training","Bristol, Tripoli",,"Tactical Training And Security Solutions, Consultancy",,
965666,0,Avenzoar,https://angel.co/avenzoar,https://d1qb2nb5cznatu.cloudfront.net/startups/i/965666-595b7e41caa350ab865267e8f1bc99c9-medium_jpg.jpg?buster=1483835380,https://d1qb2nb5cznatu.cloudfront.net/startups/i/965666-595b7e41caa350ab865267e8f1bc99c9-thumb_jpg.jpg?buster=1483835380,6,"Avenzoar is an online eLearning and studying platform for medical students, we provide test preparation for medical licensing exams.

Traditional studying material students use are hard-copy, this has always been the source of studying material for the past Avenzoar students will be able to use our platform to have better understanding of international exams structures, gain time management skills & have full access to our updated data bank without the extra cost.","Studying and test prep platform for higher education medicine students & physicians.",15,http://www.doctorsapply.com,2016-01-06T15:12:33.000Z,2017-01-08T00:29:41.000Z,,http://www.twitter.com/avenzoar,,http://www.facebook.com/avenzoarco,https://www.linkedin.com/company/avenzoar,,"Education, Higher Education, Test Prep, Medical Education ","London, Tripoli",1-10,"Startup, SaaS, Education",,https://d2gn4xht817m0g.cloudfront.net/p/product_screenshots/images/original/000/775/229/775229-89a03cfc2a9df67c61eb6f6b7e8b6efd73a34cff.png?1483305289
334987,0,"(EVERY) business services Institution",https://angel.co/every-business-services-institution,https://d1qb2nb5cznatu.cloudfront.net/startups/i/334987-e8dc1560f73d6ff2fa614510017e1c1c-medium_jpg.jpg?buster=1391382056,https://d1qb2nb5cznatu.cloudfront.net/startups/i/334987-e8dc1560f73d6ff2fa614510017e1c1c-thumb_jpg.jpg?buster=1391382056,1,"This is a quick review about service we afford including online (web store) and outdoor (marketing team) services as follows : Online retail, Online wholesale, Business offers, Investment opportunities, Business Partnership, Representative wanted, Website designing and publishing, Software and Games, Customer service, On doorstep delivery, Product sample gallery, Internet coffee, Outdoor marketing, Public relations.","Online and outdoor business services including delivery like eBay",1,http://libyaadvertise.wix.com/ulwaseet,2014-02-02T22:44:30.000Z,2014-02-05T10:13:13.000Z,,,,,,http://www.mediafire.com/watch/vyzzl9yyn9b05ar/about_project.mp4,"E-Commerce, Business Services, Wholesale, Content Delivery",Tripoli,11-50,Startup,,"https://d2gn4xht817m0g.cloudfront.net/p/product_screenshots/images/original/000/277/230/277230-62d56c557eef667f417dc041826265bd1456d2b1.png?1395349759, https://d2gn4xht817m0g.cloudfront.net/p/product_screenshots/images/original/000/277/234/277234-82704355fd4babd999e6e4fbd5eb293ee888165c.png?1395349788, https://d2gn4xht817m0g.cloudfront.net/p/product_screenshots/images/original/000/277/236/277236-45fae8e48a0eb8f8fc84ea33238d1944441046e3.png?1395349805, https://d2gn4xht817m0g.cloudfront.net/p/product_screenshots/images/original/000/277/238/277238-9c61f5603a49a10d61c56ae3d1ad02708ea515b6.png?1395349824"
74760,0,"Libyan Spider",https://angel.co/libyan-spider,https://d1qb2nb5cznatu.cloudfront.net/startups/i/74760-8cd52202af082aeb23683fd395d9ff53-medium_jpg.jpg?buster=1508866687,https://d1qb2nb5cznatu.cloudfront.net/startups/i/74760-8cd52202af082aeb23683fd395d9ff53-thumb_jpg.jpg?buster=1508866687,1,,".ly domain registrar and hosting provider",3,http://libyanspider.com,2012-03-07T22:41:03.000Z,2017-10-24T17:38:08.000Z,,,,,,,"Web Design, Domains, Software, Web Hosting",Libya,,,,
