id,community_profile,name,angellist_url,logo_url,thumb_url,quality,product_desc,high_concept,follower_count,company_url,created_at,updated_at,crunchbase_url,twitter_url,blog_url,facebook_url,linkedin_url,video_url,markets,locations,company_size,company_type,status,screenshots
147274,0,"Helios Technology Solutions ",https://angel.co/helios-technology-solutions-1,https://d1qb2nb5cznatu.cloudfront.net/startups/i/147274-13a19501a1cea56718476a64264f4474-medium_jpg.jpg?buster=1355663197,https://d1qb2nb5cznatu.cloudfront.net/startups/i/147274-13a19501a1cea56718476a64264f4474-thumb_jpg.jpg?buster=1355663197,4,"Established in 2011, Helios Technology Solutions is a specialty mobile solution provider located in Mauritius. With expertise across all the major mobile platforms, Helios Technology Solutions has delivered more than 50 apps.
Our strong technical competency, well-defined methodology and a dedicated team has helped us provide mobile solutions that offer critical business benefits, aid transformation, accelerate innovation and bring competitive edge to our clients.

Visit www.heliostechnology.org","Mobile phone applications",6,http://www.heliostechnology.org,2012-12-16T12:58:04.000Z,2012-12-16T13:07:25.000Z,,,,,,,Mobile,"Quatre Bornes",,,,
131170,0,"Safari Books Online",https://angel.co/safari-books-online,https://d1qb2nb5cznatu.cloudfront.net/startups/i/131170-1779d2364e858450eb50f19a537b3130-medium_jpg.jpg?buster=1408505991,https://d1qb2nb5cznatu.cloudfront.net/startups/i/131170-1779d2364e858450eb50f19a537b3130-thumb_jpg.jpg?buster=1408505991,9,,,15,,2012-10-21T14:10:54.000Z,2014-08-20T03:39:59.000Z,http://www.crunchbase.com/organization/safari-books-online,,,,,,"Curated Web",Sebastopol,,,,
39283,1,"O'Reilly Media",https://angel.co/o-reilly-media,https://d1qb2nb5cznatu.cloudfront.net/startups/i/39283-7072a2490ebd476f477e4c4a7f060a58-medium_jpg.jpg?buster=1343859397,https://d1qb2nb5cznatu.cloudfront.net/startups/i/39283-7072a2490ebd476f477e4c4a7f060a58-thumb_jpg.jpg?buster=1343859397,9,"O'Reilly spreads the knowledge of innovators through technology books, online services, and tech conferences. Find the technology resources you need at O'Reilly Media, a technology company at the leading edge.",,138,http://www.oreilly.com,2012-01-18T00:56:18.000Z,2012-08-01T22:16:38.000Z,http://www.crunchbase.com/organization/oreilly-media,,,http://www.facebook.com/OReilly,,,Advertising,Sebastopol,,"Seed Fund",,https://d2gn4xht817m0g.cloudfront.net/p/product_screenshots/images/original/000/368/731/368731-3186a3a312ed434eb86af0d2a129d9ee7a7f5fa7.?1407209687
