id,community_profile,name,angellist_url,logo_url,thumb_url,quality,product_desc,high_concept,follower_count,company_url,created_at,updated_at,crunchbase_url,twitter_url,blog_url,facebook_url,linkedin_url,video_url,markets,locations,company_size,company_type,status,screenshots
5580749,0,TravelBudds,https://angel.co/travelbudds,https://d1qb2nb5cznatu.cloudfront.net/startups/i/5580749-5d7c32ec9ea429e3c5df2d1ab2b17d1d-medium_jpg.jpg?buster=1523437382,https://d1qb2nb5cznatu.cloudfront.net/startups/i/5580749-5d7c32ec9ea429e3c5df2d1ab2b17d1d-thumb_jpg.jpg?buster=1523437382,0,"Travelbudds is the social network for young, mobile, connected, travel lovers looking for the most authentic ways to discover the world and share their experiences. TravelBudds will be the only tool travelers will need to go through the whole travel lifecycle from inspiration seeking, to organizing & booking, geolocalized tips during the trip and experience sharing. 
Through this social network, we aim to become the Travelers’ hub connecting users together and together with service providers, officials and brands for our users to benefit from peer-to-peer advice but also from official information. 
As of today, in terms of entrepreneurs and official institutions, we target mainly remote places and low visited countries - such as Subsaharianna Africa, South-America, Oceania -  in order to develop entrepreneurship, economic growth, employment  and last but not least, green tourism.","TravelBudds is the travel Instagram. ",2,http://www.travelbudds.com,2018-04-10T14:35:53.000Z,2018-04-11T14:50:33.000Z,,,,https://www.facebook.com/TravelBuddsOfficial/?ref=bookmarks,https://www.linkedin.com/company/travelbudds/,https://www.youtube.com/watch?v=sP92fkYD-h4,"Social Travel, Travel & Tourism, Mobile Application, Social Network",Ebène,1-10,,,"https://d2gn4xht817m0g.cloudfront.net/p/product_screenshots/images/original/000/869/515/869515-7d90cb9556ead169a3cb4fc796ef45a31da27448.jpg?1523438615, https://d2gn4xht817m0g.cloudfront.net/p/product_screenshots/images/original/000/869/516/869516-7701e6c11a00a77441821192661bbbccde381104.jpg?1523438637, https://d2gn4xht817m0g.cloudfront.net/p/product_screenshots/images/original/000/869/517/869517-0828e5e74ff34fc1789b206438f0499a9273e0ca.jpg?1523438671, https://d2gn4xht817m0g.cloudfront.net/p/product_screenshots/images/original/000/869/518/869518-3514bd680d0a56148cb529a5012baac29c2742c6.jpg?1523438682"
5559808,0,Cambio,https://angel.co/cambio-1,https://d1qb2nb5cznatu.cloudfront.net/startups/i/5559808-113ada17a22f22def050b318be6dd64a-medium_jpg.jpg?buster=1522953299,https://d1qb2nb5cznatu.cloudfront.net/startups/i/5559808-113ada17a22f22def050b318be6dd64a-thumb_jpg.jpg?buster=1522953299,0,"We offer the technology that makes bots and voice assistants pervasive and universal.","The Wordpress of bots.",5,http://usecambio.com,2018-04-05T18:34:59.000Z,2018-04-13T19:13:43.000Z,,,,,https://www.linkedin.com/company/cambio-ai/,,"Social Media, Artificial Intelligence","Port Louis",1-10,"Private Company",,
5462757,0,"Comedyplay ",https://angel.co/mycomedyplay,https://d1qb2nb5cznatu.cloudfront.net/startups/i/5462757-b84a6080357a97e921d2e71f51b86344-medium_jpg.jpg?buster=1521212820,https://d1qb2nb5cznatu.cloudfront.net/startups/i/5462757-b84a6080357a97e921d2e71f51b86344-thumb_jpg.jpg?buster=1521212820,0,"Platform to create, post, share, stream comedy content only","Platform to create, post, share, stream comedy content",1,http://Mycomedyplay.com,2018-03-16T15:07:01.000Z,2018-04-02T10:51:31.000Z,,,,,,,"Video Streaming, Entertainment Industry, Blockchains",Mauritius,,,,
5144141,0,Lifti,https://angel.co/lifti,https://d1qb2nb5cznatu.cloudfront.net/startups/i/5144141-4b26dbb59b6c15528f2f3ead58b4b1f9-medium_jpg.jpg?buster=1515471210,https://d1qb2nb5cznatu.cloudfront.net/startups/i/5144141-4b26dbb59b6c15528f2f3ead58b4b1f9-thumb_jpg.jpg?buster=1515471210,0,"Lifti is a lift-club app that matches car owners and passengers from the same neighbourhoods, travelling in the same directions, at the same times, to work and back. As a passenger, you get to work comfortably while being afforded the convenience to share fuel costs with other passengers and the driver. As a driver, you offer lifts to up to 4 passengers, reducing your monthly fuel costs by sharing","  Lifti is a lift-club app that matches car owners and passengers.",2,http://www.lifti.com,2018-01-09T04:08:03.000Z,2018-01-09T04:32:28.000Z,,,http://www.myafricanstartup.wordpress.com,https://www.facebook.com/LiftiZA/,https://www.linkedin.com/company/11363538/,https://www.youtube.com/watch?v=QrzYUxg9yoM,"South Africa","Johannesburg, Mauritius",1-10,"Mobile App, Transportation",,
4620354,0,"Futurpreneur Africa ",https://angel.co/futurpreneur-africa-1,https://d1qb2nb5cznatu.cloudfront.net/startups/i/4620354-7c53897c9af143e6d42204030ccd80dc-medium_jpg.jpg?buster=1504856118,https://d1qb2nb5cznatu.cloudfront.net/startups/i/4620354-7c53897c9af143e6d42204030ccd80dc-thumb_jpg.jpg?buster=1504856118,0,"I design the concept of Futurpreneur Talks Entrepreneurship Program which is a turn key engine to business owners, entrepreneur and future entrepreneur. 

The objective of Futurpeneur Talks Entrepreneurship Program is to implement innovation in business, creating employments and reducing poverty across the bridges worldwide. 

Futurpreneur Talks is a linear fashion from one stage will require a revisiting of a previous stage.

Futurpreneur TALKS offers mentoring, marketing tips, Innovative ideas, business trends and insights, accounting help and much more to make growing your company easier.","Entrepreneurship Program",1,https://www.facebook.com/futurpreneurmauritius,2017-09-08T07:35:19.000Z,2017-09-08T07:35:19.000Z,,,,,,,"Sales and Marketing, Accounting, Technology, Management Consulting",Mauritius,,,,
4554408,0,"Team Game",https://angel.co/team-game,https://d1qb2nb5cznatu.cloudfront.net/startups/i/4554408-63e2c86f903a29a28647fc0095e1d9b0-medium_jpg.jpg?buster=1503555348,https://d1qb2nb5cznatu.cloudfront.net/startups/i/4554408-63e2c86f903a29a28647fc0095e1d9b0-thumb_jpg.jpg?buster=1503555348,0,"Team game is a simple and fun social predictor game for the Premier League. Currently in public beta.

Team Game is a response to complicated, time-sucking prediction game based on selecting players. In Team Game, players select three teams per game week, which gain positive and negative points based on their performance (result, goals scored, cards earned).

Players can play against friends in public and private leagues, and earn badges as they play.","Social football/soccer predictor game",1,http://teamgame.co,2017-08-24T06:15:48.000Z,2017-08-24T06:17:33.000Z,,,,,,,"Sports, Fantasy Sports, Soccer",Mauritius,,,,
4185853,0,"Data Scientists",https://angel.co/data-scientists,https://d1qb2nb5cznatu.cloudfront.net/startups/i/4185853-22ba482c98228740a7db87f7f286b2da-medium_jpg.jpg?buster=1496058537,https://d1qb2nb5cznatu.cloudfront.net/startups/i/4185853-22ba482c98228740a7db87f7f286b2da-thumb_jpg.jpg?buster=1496058537,4,"Implement a real-time home security in Mauritius","Real-time Security in Mauriitus",1,http://www.datascientists.pro,2017-05-29T11:48:57.000Z,2017-05-29T13:44:27.000Z,,,,,,,"Startups, East Africa, South Africa",Mauritius,,,,
3929242,0,"Sphere Media Technologies",https://angel.co/sphere-media-technologies,https://d1qb2nb5cznatu.cloudfront.net/startups/i/3929242-9c65a74219b25e1ab30fb739b683b883-medium_jpg.jpg?buster=1491288694,https://d1qb2nb5cznatu.cloudfront.net/startups/i/3929242-9c65a74219b25e1ab30fb739b683b883-thumb_jpg.jpg?buster=1491288694,4,"Sphere Media Technologies helps you build your Digital Brand Image and Positioning for enhanced profitability through Online, Social and Mobile Platforms.

We devise and implement the right digital strategy for Customer acquisition, customer engagement, putting forward a client's products and services towards a more targeted audience.  

We reinforce and promote a brand by diligently and constantly monitoring the Reach, Penetration, Conversion and ROI

Our services include:
  - Digital Consultancy and Strategy
  - Community Management
  - Innovative Digital Campaigns
  - Google Advertising (PPC, SEO, Retargeting, Display)
  - Website Design and Web CMS Development
  - Database Management and Intelligence:
  - Targeted Email & SMS Marketing (Client Database)
  - Web, Mobile & Facebook Applications
  - Inbound-marketing (Blogging, Content Strategy, Copywriting)
  - Graphic Design Creation & Adaptation, Video Creation
  - Client-Server CMS Development
  - Loyalty Program Enhancement","Digital Marketing Partner",2,http://www.spheremedia.mu,2017-04-04T06:51:35.000Z,2017-04-04T06:51:35.000Z,,,,,,,"Social Media, Mobile Advertising, Web Development, Digital Media Marketing",Moka,,,,
3788358,0,Varcel,https://angel.co/varcel,https://d1qb2nb5cznatu.cloudfront.net/startups/i/3788358-8e413279252416a6fc8708da1fcf2a84-medium_jpg.jpg?buster=1503211446,https://d1qb2nb5cznatu.cloudfront.net/startups/i/3788358-8e413279252416a6fc8708da1fcf2a84-thumb_jpg.jpg?buster=1503211446,4,"Varcel a software company has embarked on an ambitious plan to create a revolutionary product of a logistic management, workforce management and scheduling task. the product is a smart and easy way for companies to mange their daily tasks and live tracking their fleets. 

Varcel is an off the shelf SAAS platform built with a web interface dashboard, MAC OS, Windows Dektops app, IOS and Android native apps. Varcel has been developed in house by our talented devlopers.

Varcel offers delivery management platform to businesses in delivery and pickup services, beauty services, repair services, home services, health and well being, and any other type of businesses that will need to monitor daily task in real time. With varcel revolutionary platform, businesses have better control of their on field workforce by tracking the movement live with GPS technology. Many logistics companies have encountered problem of managing their delivery business or mobile workforce.","To give any physical object a so called “digital identity”",1,https://varcelapp.com,2017-03-11T14:25:14.000Z,2017-08-20T06:44:15.000Z,,https://twitter.com/varcelapp,https://varcelapp.com/news,https://facebook.com/varcelapp,,,"Mobile, SaaS, Internet of Things, Logistics Software","New York City, Mauritius",1-10,Software,,
3741071,0,"Core Business Partners Network",https://angel.co/core-business-partners-network,https://d1qb2nb5cznatu.cloudfront.net/startups/i/3741071-64f069a949c3b9aebe7e28dd200a7735-medium_jpg.jpg?buster=1488567339,https://d1qb2nb5cznatu.cloudfront.net/startups/i/3741071-64f069a949c3b9aebe7e28dd200a7735-thumb_jpg.jpg?buster=1488567339,3,"I am the founder of core business partners network ltd  (CBPN) which aims at uniting partners from different financial centers or position with a view of doing greater & better business.

I am looking for a partner who has access with business financing in a view to partner in Green Energy Projects.

CBPN has recently been incorporated thus our website and official email address should be ready by end of March, however, we have been working on this concept since 2 years and now officially have a list of 15 high profile partners worldwide.

Our Green Energy Partner based in UK has an exclusive contract with farmers who intend to sell the project worldwide. 

He has a deal to find buyer at the most competitive price over 6 weeks. They are the world leaders in Green Energy Projects.

The Green projects have IRR above 10 % and all land can be pledged.

Above that, we have insurance companies ready to secure the investment 100% of the total amount invested.","Looking for sophisticated investors ",1,https://www.linkedin.com/in/neeleshsoogrim/,2017-03-03T18:48:02.000Z,2017-03-21T09:49:58.000Z,,,,https://www.facebook.com/neeleshkumarsingh.soogrim,https://www.linkedin.com/in/neeleshsoogrim/,,"African-American, East Africa, Johannesburg, Pretoria, Durban, And East London, South Africa",Mauritius,,"Consumer Financial Services",,
3647441,0,"ALU CampusLive",https://angel.co/alu-campuslive,https://d1qb2nb5cznatu.cloudfront.net/startups/i/3647441-c4fd2f8e5145ad3044138d43108b40a4-medium_jpg.jpg?buster=1487241436,https://d1qb2nb5cznatu.cloudfront.net/startups/i/3647441-c4fd2f8e5145ad3044138d43108b40a4-thumb_jpg.jpg?buster=1487241436,6,"Technology has improved our daily lives. We owe our comfort, productivity and the uniqueness of our lifestyle to it. We now introduce you the CampusLive, a smart app that will monitor your daily life in your university.
This app will be your companion and will assists you in your daily activity on campus by giving you the power to use your time as best as it should be.

If you love being unique, being smart, harnessing the amazing power of technology, and believe that we should spend more time enjoying life, this app is right for you.","A mobile app that add values to your University Lifestyle",1,http://tolotranet.com,2017-02-16T10:37:17.000Z,2017-02-16T10:37:17.000Z,,,,,,,Mobile,Mauritius,,,,
3328878,0,ajob.mu,https://angel.co/ajob-mu,https://d1qb2nb5cznatu.cloudfront.net/startups/i/3328878-4879c96ff3ed6c4aea519cc5ef2f6e62-medium_jpg.jpg?buster=1483549723,https://d1qb2nb5cznatu.cloudfront.net/startups/i/3328878-4879c96ff3ed6c4aea519cc5ef2f6e62-thumb_jpg.jpg?buster=1483549723,2,"Online Platform for Employers and Job Seekers in Mauritius.

For Employers: Job Posting is free!

For Job Seekers: Create resume from our Resume Builder, browse jobs and apply to jobs for free!","For Employers and Job Seekers",1,http://ajob.mu,2017-01-04T17:08:43.000Z,2017-01-04T17:15:35.000Z,,,,,,,"Mobile, Social Recruiting, Recruiting, Part Time Jobs",Mauritius,,,,https://d2gn4xht817m0g.cloudfront.net/p/product_screenshots/images/original/000/775/994/775994-aacfbecaa8e8d43a93f8da4585f2221dcb02f209.png?1483549942
2866349,0,"Bowanee & Jugernauth",https://angel.co/bowanee-jugernauth,https://d1qb2nb5cznatu.cloudfront.net/startups/i/2866349-00e495f11c8b2885b1de138bdc4fb31f-medium_jpg.jpg?buster=1477347710,https://d1qb2nb5cznatu.cloudfront.net/startups/i/2866349-00e495f11c8b2885b1de138bdc4fb31f-thumb_jpg.jpg?buster=1477347710,4,"We're currently helping different organizations in different African countries by developing various platforms to empower people & businesses.","Pioneering High-Tech Solutions for Africa",2,http://www.sitemaurice.com,2016-10-24T22:21:51.000Z,2017-02-08T05:21:32.000Z,,,,,,,"Mobile, E-Commerce, Augmented Reality, Virtual Reality","Port Louis",1-10,,,
2600874,0,Aerow,https://angel.co/aerow,https://d1qb2nb5cznatu.cloudfront.net/startups/i/2600874-ee9c58862f7e90e721c8ae5d1daf1245-medium_jpg.jpg?buster=1476941243,https://d1qb2nb5cznatu.cloudfront.net/startups/i/2600874-ee9c58862f7e90e721c8ae5d1daf1245-thumb_jpg.jpg?buster=1476941243,2,"We are experts on products like Documentum, Captiva (EMC), Sharepoint, SAP... We work for big companies like L'Oréal, Total, Alstom, BNP, Areva and we integrate solutions to virtualize all sorts of content.","We develop and integrate solutions for enterprises to manage their documents",3,http://www.aerow.mu,2016-10-05T16:23:23.000Z,2016-10-20T05:27:25.000Z,,,,,,,Content,Mauritius,11-50,,,
2459199,0,"BLUE FOUNTAIN SERVICES",https://angel.co/bluefountainltd,https://d1qb2nb5cznatu.cloudfront.net/startups/i/2459199-2128c21de123487014653d257f5fb5ca-medium_jpg.jpg?buster=1495716691,https://d1qb2nb5cznatu.cloudfront.net/startups/i/2459199-2128c21de123487014653d257f5fb5ca-thumb_jpg.jpg?buster=1495716691,5,"We are Brand Architects. We create brands and build businesses across the bridges worldwide. We Establish Legacies. 

We are the point where insights meets execution and we bridge the divide what a brand is now and it could be in the future. 

We are Creative. We are Strategic. We are Tactics. 

We are Clin D'Oeil Publicité...",https://www.facebook.com/BlueFountainLtd,1,https://www.facebook.com/BlueFountainLtd,2016-09-26T12:35:03.000Z,2017-06-19T08:03:52.000Z,,http://www.twitter.com/BlueFountainLtd,,https://www.facebook.com/BlueFountainLtd,http://www.linkedin.com/faaizah.marden,https://www.youtube.com/watch?v=xxnwTEj5f-I,"Social Media, E-Commerce, Advertising, Brand Marketing","Mauritius, Africa",1-10,,www.facebook.com/bluefountainltd,"https://d2gn4xht817m0g.cloudfront.net/p/product_screenshots/images/original/000/813/020/813020-16b0bace8e7a77a7c54696a277797602bfb268a2.jpg?1495715826, https://d2gn4xht817m0g.cloudfront.net/p/product_screenshots/images/original/000/813/021/813021-a9fc090a45927130bb41a8125542a10a1b4983ea.jpg?1495715921"
2234633,0,ICT.io,https://angel.co/ict-io,https://d1qb2nb5cznatu.cloudfront.net/startups/i/2234633-bda3396e00d96148df8f5ac9330d6dcf-medium_jpg.jpg?buster=1473711763,https://d1qb2nb5cznatu.cloudfront.net/startups/i/2234633-bda3396e00d96148df8f5ac9330d6dcf-thumb_jpg.jpg?buster=1473711763,4,"ICT.io is a media website launched in February 2015. The project has been launched to fill the void left by the local press. We are currently covering innovation, entrepreneurship and startups in Mauritius, Reunion Island and more recently Madagascar","We are the startup that promote startups in Indian Ocean",3,http://ict.io,2016-09-12T20:22:44.000Z,2016-09-12T20:28:44.000Z,http://www.crunchbase.com/organization/%2Forganization%2Fict-io,,,,,,"Digital Media, Social Media, News, Startups","Port Louis",,,,
2208584,0,"Exportunity ",https://angel.co/exportunity-1,https://d1qb2nb5cznatu.cloudfront.net/startups/i/2208584-ce19eb0391e30db58ba8cde3e630f65a-medium_jpg.jpg?buster=1473471174,https://d1qb2nb5cznatu.cloudfront.net/startups/i/2208584-ce19eb0391e30db58ba8cde3e630f65a-thumb_jpg.jpg?buster=1473471174,5,"Imagine an exclusive virtual market which, connects vendors and sellers of craft consumer goods by organizing and managing B2C and B2B trade in and between African countries; A platform which utilizes the network of Government post offices as its shipping logistic support and digitalizes their facilities, A platform that enrolls only and all the duly registered companies in each country, allowing big and small buyers to place their orders safely through secured payments and assurances and escrow mechanisms. 
This platform exists today; it is Exportunity.net; which is customized for each country’s existing infrastructures, markets, economies, and needs.","Alibaba without scams",7,http://www.exportunity.com,2016-09-10T01:32:55.000Z,2018-04-16T01:08:32.000Z,,,,,,,"E-Commerce, Wholesale, Trade Platform, Escrow","Port Louis",1-10,,,
1914413,0,"Booklee SAS",https://angel.co/booklee-sas,https://d1qb2nb5cznatu.cloudfront.net/startups/i/1914413-695c8326fbc80478e3a796516fdce5f5-medium_jpg.jpg?buster=1471904226,https://d1qb2nb5cznatu.cloudfront.net/startups/i/1914413-695c8326fbc80478e3a796516fdce5f5-thumb_jpg.jpg?buster=1471904226,1,"Online comparison for Flights, Hôtels, Cars rental and Stays.

Booklee.net comes with 7 websites for specific markets.
- VOL974.com for Réunion Island
- VOL-Maurice.com for Mauritius Island
- FLY-Algerie.com for Algéria
- etc...

Could be commercialize as a white label.

Many possibilities !","Travel comparator for niche markets",2,http://www.booklee.net,2016-08-22T21:53:48.000Z,2017-02-17T01:11:51.000Z,,,,,,https://vimeo.com/181794852,"Online Travel, Hotels, Travel, Price Comparison","Reunion, Mauritius",1-10,,,"https://d2gn4xht817m0g.cloudfront.net/p/product_screenshots/images/original/000/737/380/737380-a7c997b194e1ff38a801f39a07c6f5ea70ee6ab4.png?1471903756, https://d2gn4xht817m0g.cloudfront.net/p/product_screenshots/images/original/000/737/383/737383-8ea77173be2c5ae0125439d118de63129b1447bf.png?1471903777, https://d2gn4xht817m0g.cloudfront.net/p/product_screenshots/images/original/000/737/384/737384-fa86f7706fad859414017199df53b244f9ef88d9.png?1471903801, https://d2gn4xht817m0g.cloudfront.net/p/product_screenshots/images/original/000/737/386/737386-2c6210aadfff8462579b73f5f7400f8950e252ed.png?1471903828, https://d2gn4xht817m0g.cloudfront.net/p/product_screenshots/images/original/000/737/388/737388-666e469088e5fdb2fe73d235c5ef9edfdd0f1fd7.png?1471903854, https://d2gn4xht817m0g.cloudfront.net/p/product_screenshots/images/original/000/737/389/737389-2b6fdff1685f8f3217f379051a73cfa9467d46fc.png?1471903888, https://d2gn4xht817m0g.cloudfront.net/p/product_screenshots/images/original/000/737/391/737391-46cdaf4316769379eeb78f03f5f5e70e20b38140.png?1471903903"
1476717,0,"Cim Global Business",https://angel.co/cim-global-business-1,https://d1qb2nb5cznatu.cloudfront.net/startups/i/1476717-244a3a8dcfbfb8ddfd702a3d56c05461-medium_jpg.jpg?buster=1468991838,https://d1qb2nb5cznatu.cloudfront.net/startups/i/1476717-244a3a8dcfbfb8ddfd702a3d56c05461-thumb_jpg.jpg?buster=1468991838,1,"Cim Global Business is the leading management company in Mauritius with offices in Mauritius, South Africa and Singapore. We have a dedicated workforce over 250 people committed to the success of our international clients.

We have over USD150 billion of Assets under Administration and offer Corporate, Fund, Trust Fiduciary services and Professional Services Outsourcing solutions to our clients which include institutional investors, asset managers, private equity fund managers, development financial institutions, sovereign wealth funds, banks, hedge funds and high net worth individuals.

Cim Global Business has more than 20 years of experience in fund, corporate and trust administration. Our in-depth experience and expertise make us the partner of choice for structuring and establishing your cross border investments and transactions.","Corporate, Fund, Trust and Fiduciary services",1,https://www.cimglobalbusiness.com/index.html,2016-07-20T05:17:19.000Z,2016-07-20T05:17:19.000Z,,,,,,,"Investment Management, Professional Services, Hedge Funds, Private Equity ",Mauritius,,,,
1230678,0,"ALU Education",https://angel.co/alu-education,https://d1qb2nb5cznatu.cloudfront.net/startups/i/1230678-d7dc1677836a395bc3e115391b907f20-medium_jpg.jpg?buster=1467032644,https://d1qb2nb5cznatu.cloudfront.net/startups/i/1230678-d7dc1677836a395bc3e115391b907f20-thumb_jpg.jpg?buster=1467032644,4,"ALU Education takes a hands-on, project-centric approach to learning, with particular focus on foundational work readiness and leadership development. Students at ALU are aspiring leaders who combine applicable know-how with deep understanding of their intended users and target markets, to develop products & services that will form the future of Africa's industry.","Creating a new generation of leaders by reinventing tertiary education",2,http://alueducation.com,2016-06-27T13:04:10.000Z,2016-06-27T13:04:10.000Z,,,,,,,"Mobile, Hardware + Software",Pamplemousses,51-200,,,
1186951,0,"The American Campus",https://angel.co/the-american-campus,https://d1qb2nb5cznatu.cloudfront.net/startups/i/1186951-1c4b5c4cbbcc7cbe67ae9f9d75bcc31b-medium_jpg.jpg?buster=1465853188,https://d1qb2nb5cznatu.cloudfront.net/startups/i/1186951-1c4b5c4cbbcc7cbe67ae9f9d75bcc31b-thumb_jpg.jpg?buster=1465853188,5,"The American Campus (TAC) is a new institution of higher education designed to offer a high quality, cost-effective American education to Mauritian students and others from across Africa and Asia. It was founded by a broad coalition of U.S. educators with substantial and varied experience, and is based on the American model of active and applied academic learning.

TAC provides a superior educational experience to nurture students’ personal and career goals and to qualify them at graduation for immediate entry into the workplace, and launch them on a significant track in their chosen career. We achieve this by being well-informed about trends and opportunities in the regional job markets, and by collaborating with American university partners to offer meaningful programs on campus. Besides academic experience, students at TAC gain a supporting network of mentors, and build relationships with potential employers through internships, community service learning and applied research.","American Higher Education in Mauritius,  Africa",1,http://www.tacampus.us,2016-06-13T21:26:28.000Z,2016-06-13T21:32:04.000Z,,,,,,,"Indian Ocean Islands","Mauritius, Utah",,Education,,
1184294,0,Banza,https://angel.co/banza-1,https://d1qb2nb5cznatu.cloudfront.net/startups/i/1184294-bb8f1b185ac9f56d7e00118600867da4-medium_jpg.jpg?buster=1465758318,https://d1qb2nb5cznatu.cloudfront.net/startups/i/1184294-bb8f1b185ac9f56d7e00118600867da4-thumb_jpg.jpg?buster=1465758318,1,"Banza is an interactive digital platform connecting businesses with their target audience.","Connecting businesses with their target audience.",1,https://banzamagazine.wordpress.com/,2016-06-12T19:05:19.000Z,2017-08-05T07:21:29.000Z,,https://twitter.com/banza_imagine?lang=en,https://banzamagazine.wordpress.com/author/rutakangwa/,https://www.facebook.com/BanzaMagazine,,https://www.youtube.com/channel/UCQKIZbVJq6Y3Fgp9SYlDKaA,"Social Media, Fashion, Advertising Platforms, Magazine",Mauritius,1-10,,https://twitter.com/Banza_Imagine,"https://d2gn4xht817m0g.cloudfront.net/p/product_screenshots/images/original/000/708/638/708638-af7e14f0afd0b61fc6e8a619644be80c6173f103.png?1465786361, https://d2gn4xht817m0g.cloudfront.net/p/product_screenshots/images/original/000/708/639/708639-954a03e1ec0ce97e7a87cfd7decb5f2dec6d5a99.png?1465786429, https://d2gn4xht817m0g.cloudfront.net/p/product_screenshots/images/original/000/708/640/708640-59e845c50b8baf3dad1dddbb6bdca7f971ae3636.jpg?1465786526"
