id,community_profile,name,angellist_url,logo_url,thumb_url,quality,product_desc,high_concept,follower_count,company_url,created_at,updated_at,crunchbase_url,twitter_url,blog_url,facebook_url,linkedin_url,video_url,markets,locations,company_size,company_type,status,screenshots
5732580,0,"Afrikan Arts Foundation",https://angel.co/afrikan-arts-foundation,https://d1qb2nb5cznatu.cloudfront.net/startups/i/5732580-0b83a5bc46478d4db67646edbfab9007-medium_jpg.jpg?buster=1526285795,https://d1qb2nb5cznatu.cloudfront.net/startups/i/5732580-0b83a5bc46478d4db67646edbfab9007-thumb_jpg.jpg?buster=1526285795,0,"A Afrikan Arts Foundation é uma empresa social de gestão cultural empenhada em desafiar, desenvolver e promover o movimento artístico Moçambicano no cenário mundial para restaurar a identidade cultural dos nossos líderes criativos Africanos

Afrikan Arts Foundation is a cultural management social enterprise committed to challenge, develop & promote the Mozambican arts movement on the world stage to restore our creative African leaders' cultural identity.","Promoting & managing talented Mozambican artists on the world stage. ",2,https://afrikanart.org,2018-05-14T08:16:36.000Z,2018-05-14T09:54:08.000Z,,https://twitter.com/afrikanart_org,,https://www.facebook.com/afrikanart.org/,https://www.linkedin.com/company/afrikanart/,,Art,Maputo,1-10,"Social Enterprise",,"https://d2gn4xht817m0g.cloudfront.net/p/product_screenshots/images/original/000/874/626/874626-505f1492c9384a05392b319aaff77e2266877af3.PNG?1526289041, https://d2gn4xht817m0g.cloudfront.net/p/product_screenshots/images/original/000/874/675/874675-d44874be2cd27eebda87bd3edfe3a274f9e205d1.PNG?1526312110, https://d2gn4xht817m0g.cloudfront.net/p/product_screenshots/images/original/000/874/676/874676-0f5c687712501b847138031d9ea266141e69424c.PNG?1526312267"
5534250,0,"Marine & Auto, Concept",https://angel.co/marine-auto-concept-1,https://d1qb2nb5cznatu.cloudfront.net/startups/i/5534250-fc1775042260cb58cbb95d9d85dd7511-medium_jpg.jpg?buster=1522519196,https://d1qb2nb5cznatu.cloudfront.net/startups/i/5534250-fc1775042260cb58cbb95d9d85dd7511-thumb_jpg.jpg?buster=1522519196,0,"We sell, hire and service recreational watercrafts in Mozambique.","We are a marine recreation firm that offers watercraft leisure in Moçambique ",1,http://www.marineautoconcept.com,2018-03-31T17:59:58.000Z,2018-03-31T18:14:36.000Z,,,,https://web.facebook.com/navesaquaticas/,,,"Travel & Tourism",Maputo,,,,
5534245,0,"Marine & Auto, Concept",https://angel.co/marine-auto-concept,https://d1qb2nb5cznatu.cloudfront.net/startups/i/5534245-3e604c9320a4a5adb9e610d7c004f429-medium_jpg.jpg?buster=1522519035,https://d1qb2nb5cznatu.cloudfront.net/startups/i/5534245-3e604c9320a4a5adb9e610d7c004f429-thumb_jpg.jpg?buster=1522519035,0,"We sell, hire and service recreational watercrafts in Mozambique.","We own, hire, sell, service and operate watercrafts in Moz",1,http://www.marineautoconcept.com,2018-03-31T17:57:16.000Z,2018-03-31T18:29:48.000Z,,,,,,,"Tours & Activities",Maputo,,"Startup With Purpose",,
5507560,1,AfriqueComms,https://angel.co/afriquecomms,https://d1qb2nb5cznatu.cloudfront.net/startups/i/5507560-af436dad1fc473e70172dd6fc355d77a-medium_jpg.jpg?buster=1522065734,https://d1qb2nb5cznatu.cloudfront.net/startups/i/5507560-af436dad1fc473e70172dd6fc355d77a-thumb_jpg.jpg?buster=1522065734,0,"We are a communications agency, committed to meeting African companies needs. We create brand strategy and visual messaging. We are passionate about our work and we don't rest until we deliver something extraordinary.","Startup geeks creating lifelong African brands. ",0,http://afriquecommsgroup.com/,2018-03-26T12:02:18.000Z,2018-04-20T12:41:43.000Z,,,,,,,"Public Relations, Personal Branding, Content Marketing, Advertising & Creative Agencies",Maputo,,,,
4628238,0,"Mocimboa Empreendimento Lda",https://angel.co/mocimboa-empreendimento-lda,https://d1qb2nb5cznatu.cloudfront.net/startups/i/4628238-86d0d27fc9a7fc81a799d507f6f57668-medium_jpg.jpg?buster=1505069520,https://d1qb2nb5cznatu.cloudfront.net/startups/i/4628238-86d0d27fc9a7fc81a799d507f6f57668-thumb_jpg.jpg?buster=1505069520,0,"Mocimboa Empreendimento is a Mozambican company focused on Agriculture, Commerce, Fishing and others on Cabo Delgado Province.
Owner of a land with more than 600 Hectares in The district of Mocimboa da Praia, approx 70km to Palma district where Internacional companies are doing Hydrocarbon exploration.
At this stage we are doing Ibo coffee, coconuts and beans plantation.
Ibo coffee is a unique and one of the most expensive coffee in the world, Particularly appreciated for its low caffeine level, Ibo coffee, once brewed, develops intense herbal flavors (mainly laurel, but also mint, eucalyptus and licorice), the distinguishing feature of this unique and interesting product.

We are open to new partners that are willing to invest in Mozambique.","Agricultura: Ibo coffee, Coconuts and Beans.",1,https://www.facebook.com/pg/Mocimboa-Empreendimento-LDA-1088564837945378/about/?ref=page_internal,2017-09-10T18:52:00.000Z,2017-09-10T19:03:21.000Z,,,,,,,"Agriculture, Commerce","Mocimboa da Praia",,"Agricultural Industry.",,"https://d2gn4xht817m0g.cloudfront.net/p/product_screenshots/images/original/000/833/425/833425-9f45ce84b98341036067ed893b5518be12234d48.JPG?1505070103, https://d2gn4xht817m0g.cloudfront.net/p/product_screenshots/images/original/000/833/426/833426-629ee034eb689fe9ac9cf34a7443e72665a1f266.JPG?1505070130, https://d2gn4xht817m0g.cloudfront.net/p/product_screenshots/images/original/000/833/427/833427-055fc641be30f3228483ccc958b4e3840e520e94.JPG?1505070148, https://d2gn4xht817m0g.cloudfront.net/p/product_screenshots/images/original/000/833/428/833428-a9bc3385474138a6f91dc35b7343d964fb7343b4.JPG?1505070164, https://d2gn4xht817m0g.cloudfront.net/p/product_screenshots/images/original/000/833/429/833429-dea7b9fd870765274d969bc2b2a50580937b1902.JPG?1505070177, https://d2gn4xht817m0g.cloudfront.net/p/product_screenshots/images/original/000/833/430/833430-0c750a60477ad9e48e1363493b499efc8a9c659d.JPG?1505070192"
4297397,0,"Alpha Holdings Lda",https://angel.co/alpha-holdings-lda,https://d1qb2nb5cznatu.cloudfront.net/startups/i/4297397-53de4effac600c6fd8f6ebce490c8a28-medium_jpg.jpg?buster=1498550166,https://d1qb2nb5cznatu.cloudfront.net/startups/i/4297397-53de4effac600c6fd8f6ebce490c8a28-thumb_jpg.jpg?buster=1498550166,3,"Alpha Holdings has been awarded exclusive rights to produce and refine pure strain landrace sativa cannabis ( CBD ) oils and related products in Pemba, Mozambique. All licences are already in place and land reserved pending successful investment.
Alpha Holdings aims to be the largest, cheapest and highest quality producer and refiner of pure strain medicinal cannabis oils and related cannabis products in the world.","Cannabis Oil Production and Refining",1,http://www.alphaagrimedholdings.com,2017-06-27T07:56:06.000Z,2017-06-27T08:49:43.000Z,,,,,,,"Medical, Consumer Goods, Agriculture",Maputo,,,,
4262494,0,IOMA,https://angel.co/ioma-1,https://d1qb2nb5cznatu.cloudfront.net/startups/i/4262494-db87679dabd739bef895b49f8b98c2ba-medium_jpg.jpg?buster=1497814744,https://d1qb2nb5cznatu.cloudfront.net/startups/i/4262494-db87679dabd739bef895b49f8b98c2ba-thumb_jpg.jpg?buster=1497814744,3,"We are promoting a new project in Mozambique. Is a property development for construction of 10 Houses in Matola, Mozambique, called Jangamo Village (Vila Jangamo in portuguese, our official language).

The luxuary houses contains, 3 suits (bedroom + bathroom+ closet), 1 living room, kitchen, toilet, office, garage for 2 cars. Total area more than 200 sqm each
The common area with pool, gym, security and commercial area. 

The place is located in a zone of expansion where the new trend for the natural development of the city is passing thru. 
We as company own the land, made the project and now we are managing the process to implement. 

- We are looking for investor to build it. We consider long term loans or investor to became a partner
- The estimated budget is around1.8 M USD for the whole construction.

This market in Mozambique is very profitable, considering other countries and we intend to do other projects across Maputo and Mozambique such as houses, resorts and offices towers.","Business Development and Managing Company",2,http://iomacorporation.co.mz,2017-06-18T19:39:04.000Z,2017-06-18T19:47:07.000Z,,,,,,,"Project Management, Construction",Maputo,,,,"https://d2gn4xht817m0g.cloudfront.net/p/product_screenshots/images/original/000/817/668/817668-ef776bd678eda8cc318d34952a910938b75a21c1.JPG?1497816749, https://d2gn4xht817m0g.cloudfront.net/p/product_screenshots/images/original/000/817/669/817669-91cec6b996eb09d2c3a56c8c0c78079ea9f939c3.JPG?1497816765, https://d2gn4xht817m0g.cloudfront.net/p/product_screenshots/images/original/000/817/670/817670-3ac10077adee8653ed998428dc89bb515b17ded6.JPG?1497816777, https://d2gn4xht817m0g.cloudfront.net/p/product_screenshots/images/original/000/817/671/817671-078c7e2fd9551bf698761af8b54e7d7cd6d7adf5.JPG?1497816792"
3647355,0,MICROMZ,https://angel.co/micromz-1,https://d1qb2nb5cznatu.cloudfront.net/startups/i/3647355-9ab30057110ab1446c71bcd193fe58fe-medium_jpg.jpg?buster=1487882806,https://d1qb2nb5cznatu.cloudfront.net/startups/i/3647355-9ab30057110ab1446c71bcd193fe58fe-thumb_jpg.jpg?buster=1487882806,3,,"Rural Development for Mozambique and Africa",1,http://www.micromz.org,2017-02-16T10:11:20.000Z,2017-02-23T20:46:47.000Z,,http://twitter.com/MICROMZ,,http://facebook.com/MicroMoz,,,"Investment Management, Rural Energy, Business Development, Hardware + Software","Matola, Fourways",201-500,"Investment Advisor, Business Consulting, Investment Firm, Investment, Software Development, Consumer Financial Services",,
3535710,0,"Enko Benga International School",https://angel.co/enko-benga-international-school,https://d1qb2nb5cznatu.cloudfront.net/startups/i/3535710-c0a18acdc8096dac5e9fe3bfd7a1aac2-medium_jpg.jpg?buster=1485868852,https://d1qb2nb5cznatu.cloudfront.net/startups/i/3535710-c0a18acdc8096dac5e9fe3bfd7a1aac2-thumb_jpg.jpg?buster=1485868852,4,"Enko Benga International School will provide high quality schooling and a much needed community asset, in the heart of Tete, Mozambique. The 400 person primary and secondary school will provide International Baccalaureate education at affordable ($3,000) fee levels, in addition to providing a robust scholarship programme. Through stellar partnerships with Enko Education (top-tier Africa based school operator), Wellington College (UK based private school), the University of Oxford and Kere Associates (globally renowned architects) we have a team that can deliver a school that is both relevant and replicable. 

Opening in January 2018 the for-profit social enterprise will be based within the Benga Riverside complex; a mixed use housing and community complex which aims to re-envisage the way high quality housing is developed in Sub-Saharan Africa. The school benefits from a captive student base, due to the lack of quality school provision in the region, alongside a growing local economy.","New international school model in Mozambique",3,http://www.bengainternationalschool.com,2017-01-31T13:20:53.000Z,2017-06-12T06:46:56.000Z,,,,,,,"Education, Emerging Markets",Mozambique,11-50,,,
3176563,0,Wamina,https://angel.co/wamina,https://d1qb2nb5cznatu.cloudfront.net/startups/i/3176563-f4bd387594b97b6245bf94d6cdb2363a-medium_jpg.jpg?buster=1479715516,https://d1qb2nb5cznatu.cloudfront.net/startups/i/3176563-f4bd387594b97b6245bf94d6cdb2363a-thumb_jpg.jpg?buster=1479715516,4,"Wamina is a brand that aims to support the economic and social empowerment of Mozambican women and girls. Wamina motivates their development by providing fact-based information, products and services aimed at girls and women, and seeks solutions to everyday problems. It was in this context that the project ""Wamina Girl"" was created, the project provides reusable sanitary pads and educational workshops on menstrual hygiene management thus increasing girls’ self-esteem and self-confidence.","Reusable Menstrual Pads",2,http://www.wamina.co.mz,2016-11-21T08:05:17.000Z,2016-11-21T08:05:17.000Z,,,,,,,"Beauty, Women-Focused, Women's Apparel And Accessories",Maputo,,,,
3064125,0,"Mathária Empreendimentos",https://angel.co/matharia-empreendimentos,https://d1qb2nb5cznatu.cloudfront.net/startups/i/3064125-1aa2a5b131fff2243db382ff2ca681a0-medium_jpg.jpg?buster=1478678339,https://d1qb2nb5cznatu.cloudfront.net/startups/i/3064125-1aa2a5b131fff2243db382ff2ca681a0-thumb_jpg.jpg?buster=1478678339,4,"Moringa Leaf Powder
Dried Chilli","Moringa Leaf Powder is a highly nutritional super food",1,http://www.matharia.com,2016-11-09T07:58:59.000Z,2016-11-09T09:08:55.000Z,,,,http://facebook.com/www.faceboof.com/mathariaemp,,,"E-Commerce, Usa, Europe, South Africa",Maputo,1-10,,,https://d2gn4xht817m0g.cloudfront.net/p/product_screenshots/images/original/000/761/955/761955-f96e48a53f7b9feac04149c2d87f0271f7fbfaa0.jpg?1478679037
3052999,0,"MMP AGRO PROJETOS, LDA",https://angel.co/mmp-agro-projetos-lda,https://d1qb2nb5cznatu.cloudfront.net/startups/i/3052999-a44045cd43369189c4031d72ba7f4ae9-medium_jpg.jpg?buster=1478617178,https://d1qb2nb5cznatu.cloudfront.net/startups/i/3052999-a44045cd43369189c4031d72ba7f4ae9-thumb_jpg.jpg?buster=1478617178,4,"We are a company that groups rural and family farmers and fishermen creating a connection bridge for access to internal and external marketing markets, restructuring their business plans to facilitate access and be eligible for financing. We also design agroindustrial projects and agrarian software because our focus is on rural agroindustrialization.","Consulting ",1,https://www.facebook.com/MozambiqueManagementProcurament/?ref=bookmarks,2016-11-08T14:59:38.000Z,2016-12-31T09:47:28.000Z,,,,,,,"Social Media, Mobile Commerce, Express Mail, Digital Marketing","Maputo, Zambezia Province",,,,
1874290,0,"GreenLight Africa ",https://angel.co/greenlight-africa,https://d1qb2nb5cznatu.cloudfront.net/startups/i/1874290-29bc1cf0fc38810097fcbecf7e298ace-medium_jpg.jpg?buster=1471601903,https://d1qb2nb5cznatu.cloudfront.net/startups/i/1874290-29bc1cf0fc38810097fcbecf7e298ace-thumb_jpg.jpg?buster=1471601903,4,"GreenLight is an independent company operating out of Mozambique since 2010. We offer to our clients environmental consulting services in diverse sectors as well as project development with focus in the energy field.  We have vast local knowledge and experience acquired through on the ground presence within Mozambique and the South/East African region. Our team has established a strong international, regional and local network, both within the public sphere and private sector.","Renewable Energy Project Developer Africa ",1,http://www.greenlight-africa.com,2016-08-19T10:18:24.000Z,2016-08-19T10:18:24.000Z,,,,,,,"East Africa, South Africa",Maputo,,,,
1151594,0,"Champier Lda.",https://angel.co/champier-lda-2,https://d1qb2nb5cznatu.cloudfront.net/startups/i/1151594-67c4a9a82ef76c857ca4c8fcbc3e6f8d-medium_jpg.jpg?buster=1464191635,https://d1qb2nb5cznatu.cloudfront.net/startups/i/1151594-67c4a9a82ef76c857ca4c8fcbc3e6f8d-thumb_jpg.jpg?buster=1464191635,4,"BlackBOX TV, its the good concept of tv for Africa, its like Netflix but it wont need internet... How great its that ??? :)

Imagine watching any content you want like, new movies, tv show's, reality shows...

You only will need to connect to the TV(HDMI or AV) and power for your happiness....

In Africa, particularly country's like mine (Mozambique), have big problems with communications like internet.","Better then Netflix and made by an African ",1,http://www.champier.co.mz,2016-05-25T15:53:55.000Z,2016-05-25T15:55:46.000Z,,,,,,,"Mobile, Tablets, Computers, Smart Tv",Maputo,,,,
1094368,0,GMUSIC,https://angel.co/gmusic,https://d1qb2nb5cznatu.cloudfront.net/startups/i/1094368-a573e85448afd71651fe1ea0a899c23c-medium_jpg.jpg?buster=1460572561,https://d1qb2nb5cznatu.cloudfront.net/startups/i/1094368-a573e85448afd71651fe1ea0a899c23c-thumb_jpg.jpg?buster=1460572561,1,"In Mozambique finding local Music in an organized place is a problem, and other problem is only 4% of the musicians sell their music (via CD’s), that’s why a lot of local musicians end up poor or abandon music, and their music is not competitive because they lack money to afford quality.

Mozik lets users browse and stream local music (online and offline), read entertainment news and share their favorite content with friends inside Mozik and other social networks. 

We are in the soft-launch phase and have already partnered with Mobile Operator Vodacom, to charge the  user via a Data Bundle. 

We have a potential market of 1.000.000 users now and the market keeps growing, which makes us believe that by January 2017 we will have reached 10% of this potential market and will start generating 100.000 USD income monthly.","First Mobile Music Streaming Service",1,https://play.google.com/store/apps/details?id=mz.co.diggi.mozik,2016-04-13T18:36:02.000Z,2016-04-13T18:50:22.000Z,,,,,,,"Mobile, E-Commerce, Music Services",Maputo,,,,
1009498,0,"FiberLink Networks, Lda. Mozambique",https://angel.co/fiberlink-lda,https://d1qb2nb5cznatu.cloudfront.net/startups/i/1009498-15093accfa0f44dfa7a2dcf6612c250f-medium_jpg.jpg?buster=1455010046,https://d1qb2nb5cznatu.cloudfront.net/startups/i/1009498-15093accfa0f44dfa7a2dcf6612c250f-thumb_jpg.jpg?buster=1455010046,1,"As profissionais and with proved experience (all founders with more done 12 years in Telecom experience) we provide a full range of solutions and implementations in Telecom, Networks and IT. These are part of the project on the roll:
Creation of the first open source ultra-fast broadband telecommunications network in Africa
Creation of national high-speed IPoDWDM Backbone
High-speed VSAT interconnections in Ka and Ku band
Interconnection of Universities and High Schools as well Hospitals, health centers and private clinics as well Immigration and Customs Service, Project EduRoam for Universities
NOC for customers, with managed services
Creation of equipment (micro-probes) for remote monitoring of customers
Implementation of a voice network (VoIP / SIP) for national and international operation
Nomadic telecommunications systems for special cases (catastrophes and proximity services to people)
Online Storage and Cloud Networking
Providing MIO (Mobile Internet Office)","Welcome to the Future, Today!",1,https://www.fiberlinknetworks.com,2016-02-09T09:27:27.000Z,2016-02-09T13:51:43.000Z,,,,,,,"Internet Infrastructure, Networking, Internet of Things, Smart Mobile Solutions",Maputo,1-10,,,
987513,0,"FB & NOVINTE ENTERPRISE",https://angel.co/fb-novinte-enterprises,https://d1qb2nb5cznatu.cloudfront.net/startups/i/987513-c94649a241835a18d49965b452f15004-medium_jpg.jpg?buster=1455919447,https://d1qb2nb5cznatu.cloudfront.net/startups/i/987513-c94649a241835a18d49965b452f15004-thumb_jpg.jpg?buster=1455919447,4,"FB & NOVINTE INTERPRISES- is pro-profits Block Making Factory co. which aims to produce concrete blocks, tiles and other goods used in the construction industry for sale, in order to meet the growing market needs for construction industry in Africa precisely in the Republic of Mozambique. The FB & NOVINTE ENTERPRISES should also trigger the effectuation of construction of commercial, residential building activities, publishes and rehabilitation of roads and other services related to other infrastructure in general construction activities, and practice the import and export ofconstruction products, including raw materials and equipment, and may also participate in other companies. FB & NOVINTE ENTRPRISES aims to meet the growing demand from the construction market in Africa particularly in Mozambique where the undeniable growth of the economy and especially in the construction industry is notorious.","Brick Making Factory- (Construction)",1,http://www.semica.org.br,2016-01-23T15:40:22.000Z,2016-11-09T19:46:28.000Z,,http://twitter.com/@RaulNovinte,,https://www.facebook.com/rnovinte,"http://linkedin.com/Raul Novinte",,"East Africa",Nacala,1-10,"Private Company",,
983062,0,"Khanimoz Investments, Lda",https://angel.co/khanimoz-investments-lda,https://d1qb2nb5cznatu.cloudfront.net/startups/i/983062-0d6583866b0c7caec0a19194aa9c6aeb-medium_jpg.jpg?buster=1453406013,https://d1qb2nb5cznatu.cloudfront.net/startups/i/983062-0d6583866b0c7caec0a19194aa9c6aeb-thumb_jpg.jpg?buster=1453406013,4,"Khanimoz is to introduce  a network to facilitate electronic transactions and sales of prepaid services within Mozambican market called Pinpoint.

We aim to create a wide range of network to cater for cell phone users throughout the country, through the means of distribution and integration of non scratch cards airtime recharging vouchers, pre paid utilities, by offering solutions via VUT, Touch Screen Terminals, POS (Point of Sale), EFT or Internet, focused on expanding the availability of pre-paid services and acquisition, according to the needs of each of our partners: Cell phone Mobile companies, major retailers such as supermarket chains, and also smaller commercial establishments as well as street vendors. Pinpoint has the ability to apply diversified Prepaid Airtime Voucher Distribution onto POS (Point of Sale) terminals, Android Device and Laptop etc..","Pinpoint (Blu label telecoms)",2,"http://under construction",2016-01-20T07:35:09.000Z,2016-01-21T19:53:45.000Z,,,,,,,"Mobile, Enterprise Software, E-Commerce, Sales and Marketing",Maputo,1-10,"Technology Provider, Marketing Services, Mobile App Developer, Mobile App, Entertainment Marketing, Advertising Platform, Software Development, Music, Mobile Social Network, Consumer Financial Services",,
894514,0,O-mola,https://angel.co/o-mola,https://d1qb2nb5cznatu.cloudfront.net/startups/i/894514-ee27dd52b1f07fa35b3f026b3307bb6d-medium_jpg.jpg?buster=1448440041,https://d1qb2nb5cznatu.cloudfront.net/startups/i/894514-ee27dd52b1f07fa35b3f026b3307bb6d-thumb_jpg.jpg?buster=1448440041,1,"O-mola is a safe app that allows you to convert money and airtime to buy music and anything on the internet.","Shop Safe With Virtual Money ",2,http://omola.yolasite.com/,2015-10-29T18:34:22.000Z,2015-11-25T08:27:25.000Z,,,,,,,"E-Commerce, Mobile Commerce, Mobile Payments, Virtual Currency",Maputo,,,"Conflict Attracts Conflict, A Good Leader Knows When To Appease!",
814481,0,"Red Lemon",https://angel.co/red-lemon,https://d1qb2nb5cznatu.cloudfront.net/startups/i/814481-3307feb8c73bed503530a65a794c174d-medium_jpg.jpg?buster=1440674726,https://d1qb2nb5cznatu.cloudfront.net/startups/i/814481-3307feb8c73bed503530a65a794c174d-thumb_jpg.jpg?buster=1440674726,1,"Mozambique government is starting to take out plastic bags from circulation for ecological reasons.

With that in mind Red Lemon sees it as a huge opportunity to start manufacturing (sewing) reusable bags and distribute them to supermarkets, health clinics and all other places people need and use them. 

This will create many job opportunities, make clients save money and help to save the planet.

We pretend to start small and grow as the clientele grows. Step by step.","Eco friendly reusable bags",3,http://nazava.com,2015-08-27T10:38:16.000Z,2015-08-27T12:14:44.000Z,,,,,,https://www.youtube.com/watch?v=IKpW9qo1wqI,"Environmental Innovation",Maputo,,"Eco Sustainable",,"https://d2gn4xht817m0g.cloudfront.net/p/product_screenshots/images/original/000/578/298/578298-130000f2bfc3625dd733dae0184f53795bf176e5.jpg?1440676049, https://d2gn4xht817m0g.cloudfront.net/p/product_screenshots/images/original/000/578/304/578304-c3f447372402cc0c50d52b941823fb48e0320fc6.jpg?1440676339, https://d2gn4xht817m0g.cloudfront.net/p/product_screenshots/images/original/000/578/305/578305-f002a58d515229436d4ee9d6a0c31243be7fb274.jpg?1440676410"
777265,0,LusoCoders,https://angel.co/lusocoders,https://d1qb2nb5cznatu.cloudfront.net/startups/i/777265-9cfdb5705685339267c7c29fc5f40b34-medium_jpg.jpg?buster=1438117824,https://d1qb2nb5cznatu.cloudfront.net/startups/i/777265-9cfdb5705685339267c7c29fc5f40b34-thumb_jpg.jpg?buster=1438117824,1,"LusoCoders is an online editor that lets you create computer graphics apps using JavaScript and HTML5 canvas.","CodePen focused in computer graphics and non-native english speakers.",1,https://lusocoders.com,2015-07-28T20:51:43.000Z,2015-07-28T21:11:48.000Z,,,,,,,"Web Design, Android",Maputo,1-10,"Information Technology",,"https://d2gn4xht817m0g.cloudfront.net/p/product_screenshots/images/original/000/563/374/563374-440af640f2d6ebc435309ff957191f705b0c84e4.png?1438117491, https://d2gn4xht817m0g.cloudfront.net/p/product_screenshots/images/original/000/563/376/563376-dd07ab091e8a64ba152be5e9f39cfe694a656a22.png?1438117604, https://d2gn4xht817m0g.cloudfront.net/p/product_screenshots/images/original/000/563/379/563379-d2a57b9dff6f26d1e8bea1790842e860820a7353.png?1438118072"
773944,0,Compra.co.mz,https://angel.co/compra-co-mz,https://d1qb2nb5cznatu.cloudfront.net/startups/i/773944-fc8187440c0d844c99c02c7a4ba2756d-medium_jpg.jpg?buster=1437833012,https://d1qb2nb5cznatu.cloudfront.net/startups/i/773944-fc8187440c0d844c99c02c7a4ba2756d-thumb_jpg.jpg?buster=1437833012,4,"Compra.co.mz is a Mozambican Online Marketplace for premium brands and quality products.

It allows approved vendors and distributors to place sell their products on the platform for a commission, much like the well-known Amazon.com Marketplace business model.

Compra differentiates itself from competitors by providing on the best quality products and partnerships, allowing clients to securely shop online and with all the benefits of the traditional stores and warranties.","Mozambican Online Marketplace for premium brands ",1,http://www.compra.co.mz,2015-07-25T14:03:36.000Z,2015-07-25T14:06:05.000Z,,,,,,,"E-Commerce, Technology, Marketplace",Maputo,,,,
