id,community_profile,name,angellist_url,logo_url,thumb_url,quality,product_desc,high_concept,follower_count,company_url,created_at,updated_at,crunchbase_url,twitter_url,blog_url,facebook_url,linkedin_url,video_url,markets,locations,company_size,company_type,status,screenshots
742584,0,Mobitel,https://angel.co/mobitelmz,https://d1qb2nb5cznatu.cloudfront.net/startups/i/742584-10e48ff29b3b745faab6353f07d6ab1b-medium_jpg.jpg?buster=1484138723,https://d1qb2nb5cznatu.cloudfront.net/startups/i/742584-10e48ff29b3b745faab6353f07d6ab1b-thumb_jpg.jpg?buster=1484138723,4,"Day in and day out, we are determined to be your trusted advisor. Working together, we can make sense of your customer data and improve your digital marketing strategy.

The outcome: Better digital experiences for your customers. More conversions for your business

We envision a world where people have meaningful experiences with the brands and organizations they trust, whether in person or online. One where every digital interaction counts – be it on a website, in an app or through email – because companies will know exactly how to engage with their customers.

It’s a world that’s possible today – and we can take you there with our data-driven solutions.

By combining innovative technology with our team of trusted and creative advisors, our solutions are designed to provide actionable insights, increase customer engagement and boost revenue.

Today, Mobitel Digital platform is revolutionizing data, analytics and optimization for many of the national leading brands",,1,http://login.mymobisolutions.com,2015-06-25T14:38:49.000Z,2017-10-15T13:58:00.000Z,http://www.crunchbase.com/organization/%2Forganization%2Fmobitel,,,,,https://www.youtube.com/watch?v=3c1p8WAC7zM,"E-Commerce, Small and Medium Businesses, Retail Technology",Mozambique,1-10,"Mobile App Developer, Online Marketing, Brand Development",,"https://d2gn4xht817m0g.cloudfront.net/p/product_screenshots/images/original/000/838/926/838926-b5f369dcbfffbbaeff39355bb2cef652ebeb0de7.png?1508075742, https://d2gn4xht817m0g.cloudfront.net/p/product_screenshots/images/original/000/838/927/838927-bc514fa11954fcf63db07685bdf5553bf094e423.png?1508075755, https://d2gn4xht817m0g.cloudfront.net/p/product_screenshots/images/original/000/838/928/838928-19c4ad245c5fd4a299390e7d2d92a82e039445f7.png?1508075782, https://d2gn4xht817m0g.cloudfront.net/p/product_screenshots/images/original/000/838/929/838929-287c6ba39cd503067b145d245f1c258f87e132d0.png?1508075800, https://d2gn4xht817m0g.cloudfront.net/p/product_screenshots/images/original/000/838/930/838930-e820f471ac69f2e507bfa72983cdf88ab86721b1.png?1508075868"
696455,0,MyBest,https://angel.co/mybest,https://d1qb2nb5cznatu.cloudfront.net/startups/i/696455-80eda3ed540ff1aa2d90e991c3d6e684-medium_jpg.jpg?buster=1431936552,https://d1qb2nb5cznatu.cloudfront.net/startups/i/696455-80eda3ed540ff1aa2d90e991c3d6e684-thumb_jpg.jpg?buster=1431936552,4,"1. We develop properties in the ""residential / commercial / hospitality"" areas for long-term lease purpose;

2. Our properties help the customers to setup them's businesses in our region, or to shift from an exisiting place to our facilities, which offers a ""premium location"" and ""superior quality"";

3. Our customers are medium & big size companies related to the ""mineral resources industry"".","Converting knoledge, into best real-estate businesses...",2,http://www.mybest.co.mz,2015-05-12T09:59:14.000Z,2016-12-06T22:06:41.000Z,http://www.crunchbase.com/organization/%2Forganization%2Fmybest-2,,,,https://www.linkedin.com/in/rahimgulamhussen,,"Hospitality, Commercial Real Estate, Real Estate Technology, Residential Real Estate",Pemba,11-50,,,"https://d2gn4xht817m0g.cloudfront.net/p/product_screenshots/images/original/000/525/683/525683-685360849dde9aea3f6cce5952355ddde1d3c19d.jpg?1431936749, https://d2gn4xht817m0g.cloudfront.net/p/product_screenshots/images/original/000/525/684/525684-97402a1fa14a8581638c09d0591964e4b2a2dc41.jpg?1431936847, https://d2gn4xht817m0g.cloudfront.net/p/product_screenshots/images/original/000/525/685/525685-31b9c1bb29ca805541b3bc5194096c1d7989d067.jpg?1431936993"
678266,0,"SETMA ",https://angel.co/setma,https://d1qb2nb5cznatu.cloudfront.net/startups/i/678266-aec95bdea2b7347789b030a68b949dcb-medium_jpg.jpg?buster=1429796207,https://d1qb2nb5cznatu.cloudfront.net/startups/i/678266-aec95bdea2b7347789b030a68b949dcb-thumb_jpg.jpg?buster=1429796207,1,"Mercado Único is an eprocurment system created to join together Consumers and suppliers, allowing suppliers to increase their revenue by increasing their products visibility and consumers to buy products at better prices by PO suppliers combination.

Mercado Único meant to help startups compete in same level as a long time stabelized company in sence that there is no descimination, no corruption and no pre connections influence in between.",eprocurement,4,http://www.mercadounico.co.mz,2015-04-23T13:36:52.000Z,2015-04-27T07:13:13.000Z,,,,,,,E-Commerce,Maputo,,,,"https://d2gn4xht817m0g.cloudfront.net/p/product_screenshots/images/original/000/512/034/512034-e233a2660e6d762bad455aa9fff3c9316070a1c5.jpg?1429796816, https://d2gn4xht817m0g.cloudfront.net/p/product_screenshots/images/original/000/512/036/512036-b5a3122df71c1830f1a6857d2c79a37c00f3bf3c.jpg?1429796946"
602001,0,"SAKUDIMBA Lda.",https://angel.co/sakudimba-lda,https://d1qb2nb5cznatu.cloudfront.net/startups/i/602001-6a3e2284e584c9198458811812867f47-medium_jpg.jpg?buster=1423259081,https://d1qb2nb5cznatu.cloudfront.net/startups/i/602001-6a3e2284e584c9198458811812867f47-thumb_jpg.jpg?buster=1423259081,4,"SAKUDIMBA Lda. is looking for investors to invest in multiple ares in Mozambique. ","Investing in Mozambique",1,http://sakudimba.com.mz,2015-02-06T21:44:45.000Z,2015-02-06T21:55:38.000Z,,,,,,,"Location Based Services, Enterprise Security, Logistics, Minerals",Mozambique,,,,
438248,1,"Mozambique Tourism",https://angel.co/mozambique-tourism,https://d1qb2nb5cznatu.cloudfront.net/startups/i/438248-d0eb878289821e95c33eb730f199dd09-medium_jpg.jpg?buster=1405375324,https://d1qb2nb5cznatu.cloudfront.net/startups/i/438248-d0eb878289821e95c33eb730f199dd09-thumb_jpg.jpg?buster=1405375324,1,,,0,http://www.mozambiquetourism.co.za,2014-07-14T22:02:03.000Z,2014-07-14T22:02:46.000Z,http://www.crunchbase.com/organization/mozambique-tourism,http://www.twitter.com/mozambiquetrips,,,,,"Tourism, Travel",Mozambique,,,,https://d2gn4xht817m0g.cloudfront.net/p/product_screenshots/images/original/000/354/072/354072-0fb162b54665707261e31069ae5b2340861c48c0.?1405375356
423511,0,"Mozambikes, Lda",https://angel.co/mozambikes-lda,https://d1qb2nb5cznatu.cloudfront.net/startups/i/423511-67ecbe5eec816d17da14da29f5aa1d1a-medium_jpg.jpg?buster=1407228198,https://d1qb2nb5cznatu.cloudfront.net/startups/i/423511-67ecbe5eec816d17da14da29f5aa1d1a-thumb_jpg.jpg?buster=1407228198,6,"Mozambikes has designed a sturdy bicycle with features important to rural Africa, including a rear carrier, removable lantern and thicker tires. Mozambikes brands these bicycles with the colors and logos of companies, NGOs and other organizations, leveraging public and private sector funds to accomplish our mission.  

Bicycles have become the most innovative form or advertising, as they reach rural communities where no other media channels reach.  In urban areas, they are more effective than static ads and generate ""loyalty"" for the brand.  Mozambikes also serve for employee transportation and community social initiatives.

In Mozambique, 50% of the 23MM people live on less than $2 per day.  Bicycles provide access to income opportunities, healthcare and clean water.  However, existing bicycles are poor quality and still too expensive for the people who truly need them.  The Mozambikes model accomplishes this while filling a private sector need.","Mozambikes is a for-profit social venture fighting poverty with BICYCLES",8,http://www.mozambikes.com,2014-06-22T09:16:16.000Z,2014-08-05T11:43:11.000Z,,https://twitter.com/Mozambikes,http://www.mozambikesblog.com,https://www.facebook.com/Mozambikes,https://www.linkedin.com/company/2324264,https://www.youtube.com/watch?v=k0jvLf_O6tY,"East Africa, South Africa",Maputo,11-50,"Social Venture",,"https://d2gn4xht817m0g.cloudfront.net/p/product_screenshots/images/original/000/350/341/350341-c580ab9fc2d4ee7de2549bd52f4df9065cc3ddd2.jpg?1404809890, https://d2gn4xht817m0g.cloudfront.net/p/product_screenshots/images/original/000/368/866/368866-24a7644493ff311773777b26cff7cc8c517dbf01.jpg?1407228298, https://d2gn4xht817m0g.cloudfront.net/p/product_screenshots/images/original/000/368/868/368868-0310cca5dd3a4bbe365c3d4e403102c31e9fb388.png?1407228456, https://d2gn4xht817m0g.cloudfront.net/p/product_screenshots/images/original/000/368/872/368872-94dcd6451ec3309b05bdb7b2f578e8020dadbc26.JPG?1407228734, https://d2gn4xht817m0g.cloudfront.net/p/product_screenshots/images/original/000/368/873/368873-dd5f0919a8fa33977afacf816a25ac43eabc7db8.JPG?1407228807, https://d2gn4xht817m0g.cloudfront.net/p/product_screenshots/images/original/000/368/874/368874-a6ff3fc32e0b5ccfd5841eb2e276dc7bac0c772e.JPG?1407228893, https://d2gn4xht817m0g.cloudfront.net/p/product_screenshots/images/original/000/368/875/368875-4c73c2bf6377d860e5ef48b7099a2aa6912ffa53.JPG?1407228986"
297303,0,"Agenda Mahala",https://angel.co/agenda-mahala,https://d1qb2nb5cznatu.cloudfront.net/startups/i/297303-6edf5def5692488a8b78dd8596a427d2-medium_jpg.jpg?buster=1519810356,https://d1qb2nb5cznatu.cloudfront.net/startups/i/297303-6edf5def5692488a8b78dd8596a427d2-thumb_jpg.jpg?buster=1519810356,1,"Agenda Mahala
What is it?
Agenda Mahala is a web app that is an online calendar, planner, scheduler, shared calendar, that incorporates note taking, online storage, bookmark manager, ability to embed youtube videos and recorded audios, to do lists and to do lists management, which makes it perfect for College Students, Students and Workers, because they can save and keep tons of information in an organised fashion. They can keep notes, electronic books, links to relevant sites and more.

What does it do?
It organises the user's life and makes it easy to keep and retrieve information. It is like your personal internet, with all the links, files and youtube videos you care about. It is a great asset for a student, because he can keep information in his agenda that he will want to use in the future.","Shared Agenda and Calendar for Students and College Students",3,https://agendamahala.com,2013-11-20T00:03:26.000Z,2018-03-06T22:30:32.000Z,http://www.crunchbase.com/organization/%2525252Forganization%2525252Fagenda-mahala,,,,,,"Cloud Computing, Education, Colleges",Maputo,,,,"https://d2gn4xht817m0g.cloudfront.net/p/product_screenshots/images/original/000/862/381/862381-bf147eacc36ee85c2bb9df4e22871dd92ea2b9c2.png?1519807108, https://d2gn4xht817m0g.cloudfront.net/p/product_screenshots/images/original/000/862/382/862382-f1edec98adf84fa9c42f42c303b0218d42a40a7d.png?1519807126, https://d2gn4xht817m0g.cloudfront.net/p/product_screenshots/images/original/000/862/383/862383-bbd7ddc98a453010609981ded11a06a3533d82c1.jpg?1519807262"
90320,0,"Maguiguane Consulting (MC)",https://angel.co/maguiguane-consulting-mc,https://d1qb2nb5cznatu.cloudfront.net/startups/i/90320-978820a18ab1886cc22c4c0439eda5ef-medium_jpg.jpg?buster=1337089396,https://d1qb2nb5cznatu.cloudfront.net/startups/i/90320-978820a18ab1886cc22c4c0439eda5ef-thumb_jpg.jpg?buster=1337089396,4,"MC facilitates new business development through international partnerships in Mozambique","Build global partnerships and foster a culture of entrepreneurship and investment in Moz",6,http://mozambicanscholar.wix.com/maguiguaneconsulting,2012-05-15T13:37:25.000Z,2012-07-23T15:50:53.000Z,,http://twitter.com/zeca72,,,,,"Education, Consulting, Startups, Incubators",Maputo,,,,
